{
  "build_name": "<build name>",
  "build_surface": "blender",
  "object_ids": [
    "^S_WALL_H",
    "^S_ROOF_M_WIN"
  ],
  "precedence_resolutions": [
    {
      "objectid": "^S_WALL_H",
      "governing_tier": 2,
      "source_file": "library/authoritative_snap/relational_map_combined_v01.json",
      "source_ref": "snap_group:HALF_WALLS",
      "method": "WALL_SHELL_GRID_COURSE"
    },
    {
      "objectid": "^S_ROOF_M_WIN",
      "governing_tier": 4,
      "source_file": "library/nms_master_part_map_verified_data_v3_01_02.json",
      "source_ref": "partmap_row:S_ROOF_M_WIN",
      "method": "SURFACE_REST_DECOR"
    }
  ],
  "sources_checked": [
    "data/PLACEMENT_PRECEDENCE.json",
    "library/authoritative_snap/relational_map_combined_v01.json",
    "library/nms_master_part_map_verified_data_v3_01_02.json",
    "data/NEGATIVE_KNOWLEDGE_INDEX.json"
  ],
  "compliance_statement": "Precedence resolved per ObjectID before placement; governing sources cited above; documents FOLLOWED with no deviation."
}